tmin,tmax,speaker,message
1311.0,1507.0,Subject,"Yeah. Well, it was really a tough time early in the season. Because they started off what? One and four or something like that, and they've kind of rallied back. So it's a pretty interesting season, especially Big Ben being injured and losing [inaudible] and Antonio Brown. It's been interesting. They definitely rallied back. The defense is really good, hasn't been really good in a lot of years. So that's fun. Because that was the Steelers football's race to power. The offense was solid. The quarterback was a game manager [inaudible] for the most part, but it was the defense that was stifling. So it's kind of cool seeing them get back to that, their really hard-nosed defensive style football. Yeah. So I guess, basketball, boxing, football. I'm not really into soccer. Just doesn't really do it for me. I just think there's probably-- probably, the thing with soccer that just doesn't capture me is just a lack of scoring. So what they should do to make me happy, is make the field smaller and make the goals bigger. And just up it. It's the same game, you're still playing, but it'll become more like a basketball-- just a foot version of basketball sometimes, I guess, is what I want. And just up the scoring.  Hockey, never really been able to get into hockey. I think it's just too-- it's hard to keep track of the puck, and it's a little too fast-paced. I like how dynamic basketball is and I like that it's fast-paced. That's what I like about it over football. Football is too structured for me. But hockey lacks it. It feels like it lacks any kind of structure. I mean, from somebody who's never played. Maybe if I had played, I'd have some intuition about it. So hockey, I think if I go to a game, I'd be into it, for sure. And I probably could get into it. If I dated a girl that was really into hockey, then I probably sit and watch a game and I learn something about it. What other major sports are there? Tennis. I could see how it could be interesting. But again, there's never really the time. I never played it. But obviously, they're incredible athletes.  What's another? What's another major sport? Baseball. That's the last one. Right? Baseball is incredibly boring to me. And I just can't [laughter]-- I can't do it. I can't watch those games. I guess, like soccer in this way. The end of the games can be really exciting because the tension, especially-- then, almost low scoring becomes an advantage. There's some other word I was looking for there. Because then it's 1:1 or 1:0, and there's been this tight game the whole time. Then they're saying, can they pull it off? And it's like every single swing and every single shot on goal is tense and exciting. Basketball, you have that too. But it's such a high pace you're likely to get a -- you always have the bounce back from another shot, another opportunity. For instance, shot on goal in soccer, I mean, how many good shots do you get on a goal really in a game? So that's where I can kind of see the benefit of having a low-scoring sport. Baseball, I can go to a game but not that interesting watching it on TV. Just haven't been able to do it. I caught a couple of the games, the world series games, because my buddy is from Houston, so he was watching it. But, yeah."
1507.0,1508.0,Interviewer,And did you play any sports growing up?
1508.0,1572.0,Subject,"Basketball. Yeah, basketball is my sport. I was competitive with it. I had a scholarship out of high school. I never ended up playing anywhere. But I took it very seriously in high school. I played it in prep school for a year. My goal with basketball-- so I really got into it end of middle school, and I really got obsessed with it and I got pretty good, going into high school. And I think at the beginning of high school-- I transitioned from a Catholic school to the public school, and then I also transitioned from being kind of, not a loner, I had friends at school, but I was into reading and drawing and playing basketball. I guess I was into hobbies. I wanted to get good at things. And then I also discovered girls and hanging out, and then everything else went to the wayside [laughter]. I tended to not do that well at school and wasn't working on my basketball skills. And then life things happened and then I had, whatever, an epiphany that led to maturity. And I decided I really want to get good at basketball and use it as a tool to get into an ivy league school. Because that was the only way I was going to be able to get into an ivy league school."
1572.0,1574.0,Interviewer,And that was the epiphany?
1574.0,1824.0,Subject,"Yeah. That I really like ideas and I really like being in that world. And for me to get into the elite world of ideas, I need to use sports now because I wasn't going to have the grades. My certificate for my grades were just mediocre. So I then got really focused again. I was 16 or so. But at that point, it's kind of late because everybody's been on the [inaudible] teams and already been scouted. People kind of know who they want. Sophomore, you're going into junior in terms of recruiting. So I got a lot better, and I did get recruited. I got recruited by Columbia, and I thought I was going to go to Columbia for a while. And then Penn was interested after I-- so I did an additional year of prep school. And Penn was interested after that. But I had a scholarship to a school, Long Island University CW post, which is a really good D2 school. And they were thinking of making the transition to D1. But I didn't really want to play D2, I wanted to play D1. I felt I was a D1 player. Also, I went there, and there was this kind of like-- it just felt really bro-y and just a kind of like a Long Island bro party school. And I was like, ""That's cool."" But what I really wanted was maybe some of that, but I really wanted to be in this world with high academics but also good sports.  So I thought, Columbia, I think at the time was okay. Harvard, they never showed any interest. But Harvard, I don't know if they were starting-- they definitely got good because my buddy from high school played at Harvard and they got pretty good. And they actually went to [inaudible] one year. And I don't know if they were good at that time. But it was mainly Penn. Penn was always historic for the good basketball team for the ivy league. They had a history of sometimes being [inaudible] or whatever, being competitive with higher-level D1 schools. But I just kind of felt their own this-- and I had a decent year in prep school but personalities and all this sort of thing. The way I prepared probably wasn't ideal. So I ended up going to William & Mary with the goal of walking on and initially got-- this really still kind of rattles me. I got promised a walk-on spot. Seems like if you get in, you're on the team. And I was definitely better than some of the guys on the team too. I was definitely better than the kid that ended up walking on [laughter]. Obviously, I would say that, but this kid wasn't good. He was not a D1 player. He was a D3 at best. He wouldn't have been able to start on most D3 teams. But anyways, but the guy ended up chipping me out of the spot or whatever. And then he's like, ""Oh well, the try-outs [inaudible]."" What do mean, the try outs? You said I was going to be on the team. Then I kind of knew something was-- yeah, that's kind of weird. And he didn't care enough necessarily to screw me over. What does it matter? I'm a walk-on. But what it turns out was, that kid was the son of the coach from an elite-- he coached an elite prep school and they were recruiting some of the kids there. So it was politics. So I get it. But don't promise me a spot on the team then.  But I think, in the long run, he probably helped me to get in because I probably didn't have the grades to get in William & Mary either. William & Mary is probably just a natural ivy league. So still, in the long run, basketball helped me get to William & Mary. Yeah. And from there, I just focused. I still played. And then I still play occasionally. Some buddies of mine that still play pro ball overseas or whatever. But then it became about academics. I think if I had played-- if I played at William & Mary-- if I'd had a degree from William & Mary, I probably would have done pretty well academically. But I probably wouldn't have volunteered in the lab. Probably wouldn't be here getting a Ph.D., so just chance and the way things unfold. But I think I'm happier with this trajectory than if I had been successful at basketball. If I had been successful at basketball, I had a very clear ceiling. I could have been a decent D1 player, I think. But not the NBA. Maybe overseas in one of these middling leagues, and make some decent money maybe, if I really maxed out my potential. I was a pretty good athlete. But then what? You play for a few years. Your whole skillset is just athletics, and then what? What do you do after? You coach? I never really wanted to be a coach. So I'm kind of glad. I think that was a good out at that time because it got me to a better school, which was kind of a goal, and I got to focus on the thing I care about, which is throwing up ideas."
1824.0,1827.0,Interviewer,Yeah. That makes a lot of sense. And we've got everything we need from you. That's all.
1827.0,1828.0,Subject,Cool.
1828.0,1829.0,Interviewer,"Yeah, cool."
1829.0,1830.0,Subject,"Yeah, I can talk, man [laughter]."
1830.0,1832.0,Interviewer,Yeah. I told you it'd be easy.
