tmin,tmax,speaker,message
1747.0,1762.0,Subject,"And then I think about, so say, I was at the theater or I was at the mall or I was at the movies or I was at the restaurant, in that outfit. I picture myself in those places and I guess that takes up lots of time [laughter]."
1762.0,1767.0,Interviewer,"Have people told you that you take a long time, or you just feel like you do?"
1767.0,1805.0,Subject,"Well, if I go out with male friends and family members, they'll say I take a long time. But honestly, it's not just in the clothing store. I do that if I go to the supermarkets, like a Whole Foods or something. But you know why? Because I'm a big advocate of exploring your store and just seeing what's there. Because I feel that all stores are not created equally and you have to know what's in your store. So, if there is a time where you need to run out and get something quickly, you know where it is."
1805.0,1808.0,Interviewer,There you go. You got to know where stuff is.
1808.0,1814.0,Subject,And I just like being surrounded by the natural stuff too. I will admit that that's it.
1814.0,1819.0,Interviewer,"All right, well, I think we can go ahead and stop there."
1819.0,1822.0,Subject,Okay. I hope it was interesting for you.
